{
	"$ref": "#/definitions/Options",
	"$schema": "http://json-schema.org/draft-07/schema#",
	"definitions": {
		"ChartOption": {
			"additionalProperties": false,
			"properties": {
				"accumulatedValues": {
					"items": {
						"additionalProperties": false,
						"properties": {
							"name": {
								"type": "string"
							},
							"values": {
								"items": {
									"type": "string"
								},
								"type": "array"
							}
						},
						"required": ["name", "values"],
						"type": "object"
					},
					"type": "array"
				},
				"aggregations": {
					"items": {
						"type": "string"
					},
					"type": "array"
				},
				"hintText": {
					"items": {
						"type": "string"
					},
					"type": "array"
				},
				"legendMapping": {
					"additionalProperties": {
						"type": "string"
					},
					"type": "object"
				},
				"tooltips": {
					"additionalProperties": {
						"type": "string"
					},
					"type": "object"
				}
			},
			"type": "object"
		},
		"ChartOptions": {
			"additionalProperties": {
				"$ref": "#/definitions/ChartOption"
			},
			"type": "object"
		},
		"FacetCountOptions": {
			"additionalProperties": false,
			"properties": {
				"hoverText": {
					"additionalProperties": {
						"type": "string"
					},
					"description": "Hover text for each stratifier in the catalogue",
					"type": "object"
				}
			},
			"required": ["hoverText"],
			"type": "object"
		},
		"HeaderData": {
			"additionalProperties": false,
			"properties": {
				"aggregatedDataKeys": {
					"items": {
						"additionalProperties": false,
						"properties": {
							"groupCode": {
								"type": "string"
							},
							"stratifierCode": {
								"type": "string"
							},
							"stratumCode": {
								"type": "string"
							}
						},
						"type": "object"
					},
					"type": "array"
				},
				"dataKey": {
					"type": "string"
				},
				"hintText": {
					"items": {
						"type": "string"
					},
					"type": "array"
				},
				"title": {
					"type": "string"
				}
			},
			"required": ["title"],
			"type": "object"
		},
		"NegotiateOptions": {
			"additionalProperties": false,
			"properties": {
				"authorizationHeader": {
					"description": "The value of the Authorization header for the POST request.",
					"type": "string"
				},
				"siteMappings": {
					"description": "Maps the site names in the results table to the unique identifiers expected by the BBMRI Negotiator.",
					"items": {
						"$ref": "#/definitions/NegotiateOptionsSiteMapping"
					},
					"type": "array"
				},
				"url": {
					"description": "The URL of the BBMRI Negotiator API endpoint that creates a request to apply for access. The URL path is typically /api/v3/requests. Lens will send a POST request to the URL to start the application process.",
					"type": "string"
				}
			},
			"required": ["url", "authorizationHeader", "siteMappings"],
			"type": "object"
		},
		"NegotiateOptionsSiteMapping": {
			"additionalProperties": false,
			"properties": {
				"collection": {
					"description": "Unique identifier of the collection, e.g. \"bbmri-eric:ID:DE_RWTHCBMB:collection:RWTHCBMB_BC\"",
					"type": "string"
				},
				"collection_name": {
					"description": "Name of the collection, e.g. \"Collection of RWTH cBMB Broad Consent Aachen\"",
					"type": "string"
				},
				"site": {
					"description": "Name of the site, e.g. \"Aachen\". This must correspond to the site names as they are displayed in the results table.",
					"type": "string"
				},
				"site_id": {
					"description": "Unique identifier of the site, e.g. \"bbmri-eric:ID:DE_RWTHCBMB\"",
					"type": "string"
				}
			},
			"required": ["site", "collection", "site_id", "collection_name"],
			"type": "object"
		},
		"Options": {
			"additionalProperties": false,
			"properties": {
				"autoUpdateQueryInUrl": {
					"description": "Whether to automatically update the query in the URL when it changes (default: true)",
					"type": "boolean"
				},
				"chartOptions": {
					"$ref": "#/definitions/ChartOptions"
				},
				"facetCount": {
					"$ref": "#/definitions/FacetCountOptions",
					"description": "If set, fetch and display facet counts (number of results per discrete value) in the catalogue."
				},
				"language": {
					"description": "Two letter language code of the application language",
					"type": "string"
				},
				"negotiateOptions": {
					"$ref": "#/definitions/NegotiateOptions"
				},
				"projectmanagerOptions": {
					"$ref": "#/definitions/ProjectManagerOptions"
				},
				"resultSummaryOptions": {
					"$ref": "#/definitions/ResultSummaryOptions"
				},
				"siteMappings": {
					"additionalProperties": {
						"type": "string"
					},
					"type": "object"
				},
				"sitesToQuery": {
					"description": "List of sites to query used by `querySpot` function and facet counts. If not set no sites are sent to Spot and Spot determines the sites to query.",
					"items": {
						"type": "string"
					},
					"type": "array"
				},
				"spotUrl": {
					"description": "URL of the Spot API endpoint used by `querySpot` function and facet counts.",
					"type": "string"
				},
				"tableOptions": {
					"$ref": "#/definitions/TableOptions"
				},
				"texts": {
					"$ref": "#/definitions/Texts",
					"description": "Allows to customize texts and add new translations"
				}
			},
			"type": "object"
		},
		"ProjectManagerOptions": {
			"additionalProperties": false,
			"properties": {
				"editProjectUrl": {
					"type": "string"
				},
				"newProjectUrl": {
					"type": "string"
				},
				"siteMappings": {
					"items": {
						"$ref": "#/definitions/ProjectManagerOptionsSiteMapping"
					},
					"type": "array"
				}
			},
			"required": ["newProjectUrl", "editProjectUrl", "siteMappings"],
			"type": "object"
		},
		"ProjectManagerOptionsSiteMapping": {
			"additionalProperties": false,
			"properties": {
				"collection": {
					"type": "string"
				},
				"site": {
					"type": "string"
				}
			},
			"required": ["site", "collection"],
			"type": "object"
		},
		"ResultSummaryOptions": {
			"additionalProperties": false,
			"properties": {
				"dataTypes": {
					"items": {
						"$ref": "#/definitions/HeaderData"
					},
					"type": "array"
				},
				"infoButtonText": {
					"type": "string"
				},
				"title": {
					"type": "string"
				}
			},
			"required": ["dataTypes"],
			"type": "object"
		},
		"TableOptions": {
			"additionalProperties": false,
			"properties": {
				"headerData": {
					"items": {
						"$ref": "#/definitions/HeaderData"
					},
					"type": "array"
				}
			},
			"required": ["headerData"],
			"type": "object"
		},
		"Texts": {
			"additionalProperties": {
				"additionalProperties": {
					"type": "string"
				},
				"type": "object"
			},
			"description": "A map of texts that are displayed in the application. The keys are used to look up the text in the application code. The values are objects that map two letter language codes to the actual text.",
			"type": "object"
		}
	}
}
