{
	"siteMappings": {
		"berlin-test": "Berlin",
		"bonn": "Bonn",
		"dresden": "Dresden",
		"essen": "Essen",
		"frankfurt": "Frankfurt",
		"freiburg": "Freiburg",
		"hannover": "Hannover",
		"mainz": "Mainz",
		"muenchen-lmu": "München(LMU)",
		"muenchen-tum": "München(TUM)",
		"ulm": "Ulm",
		"wuerzburg": "Würzburg",
		"mannheim": "Mannheim",
		"dktk-test": "DKTK-Test",
		"hamburg": "Hamburg",
		"nngm-test": "NDP",
		"proxy2": "NDP"
	},
	"chartOptions": {
		"patients": {
			"legendMapping": {
				"berlin": "Berlin",
				"berlin-test": "Berlin",
				"bonn": "Bonn",
				"dresden": "Dresden",
				"essen": "Essen",
				"frankfurt": "Frankfurt",
				"freiburg": "Freiburg",
				"hannover": "Hannover",
				"mainz": "Mainz",
				"muenchen-lmu": "München(LMU)",
				"muenchen-tum": "München(TUM)",
				"ulm": "Ulm",
				"wuerzburg": "Würzburg",
				"mannheim": "Mannheim",
				"dktk-test": "DKTK-Test",
				"hamburg": "Hamburg"
			}
		},
		"gender": {
			"legendMapping": {
				"male": "Männlich",
				"female": "Weiblich",
				"unknown": "Unbekannt",
				"other": "Divers"
			}
		},
		"diagnosis": {
			"hintText": [
				"Bei Patienten mit mehreren onkologischen Diagnosen werden auch Einträge angezeigt, die ggfs. nicht den ausgewählten Suchkriterien entsprechen."
			]
		},
		"age_at_diagnosis": {
			"hintText": [
				"Bei Patienten mit mehreren Erstdiagnosen werden auch Einträge angezeigt, die ggfs. außerhalb der Suchkriterien liegen. "
			]
		},
		"67162-8": {
			"hintText": [
				"\"verstorben\": ein Todesdatum ist dokumentiert oder das aktuelle Lebensalter ist größer 123 Jahre.",
				"\"lebend\": wird angenommen, wenn kein Todesdatum dokumentiert ist oder das aktuelle Lebensalter nicht 123 Jahre überschritten hat.",
				"\"unbekannt\": kein Geburtsdatum oder Todesdatum bekannt."
			],
			"legendMapping": {
				"L": "lebt",
				"T": "verstorben",
				"A": "lost to follow-up"
			}
		},
		"72166-2": {
			"legendMapping": {
				"LA15920-4": "Ehemaliger Raucher",
				"LA18978-9": "Niemals Raucher",
				"LA18979-7": "Raucher, aktueller Status unbekannt",
				"unknown": "Unbekannt"
			}
		},

		"89247-1": {
			"hintText": [
				"\"LA9622-7\": Voll aktiv, in der Lage, alle Leistungen vor der Erkrankung ohne Einschränkung zu erbringen",
				"\"LA9623-5\": Bei körperlich anstrengender Tätigkeit eingeschränkt, aber gehfähig und in der Lage, leichte oder sitzende Arbeiten zu verrichten, z. B. leichte Hausarbeit, Büroarbeit",
				"\"LA9624-3\": Gehfähig und in der Lage, sich selbst zu versorgen, aber nicht in der Lage, Arbeitstätigkeiten zu verrichten. Mehr als 50 % der wachen Zeit auf den Beinen",
				"\"LA9625-0\": Nur begrenzt in der Lage, sich selbst zu versorgen, mehr als 50 % der wachen Zeit an das Bett oder den Stuhl gefesselt",
				"\"LA9626-8\": Völlig behindert. Kann sich nicht mehr selbst versorgen. Völlig an das Bett oder den Stuhl gefesselt",
				"\"LA9627-6\": Tot"
			],
			"legendMapping": {
				"LA9622-7": "Voll aktiv",
				"LA9623-5": "eingeschränkt",
				"LA9624-3": "gehfähig",
				"LA9625-0": "begrenzt",
				"LA9626-8": "völlig behindert",
				"LA9627-6": "Tot"
			}
		},
		"therapy_of_tumor": {
			"hintText": [
				"Bei Patienten mit mehreren onkologischen Diagnosen werden auch Einträge angezeigt, die ggfs. nicht den ausgewählten Suchkriterien entsprechen."
			],
			"aggregations": ["medicationStatements"],
			"tooltips": {
				"OP": "Operationen",
				"ST": "Strahlentherapien",
				"medicationStatements": "Systemische Therapien"
			}
		},
		"medicationStatements": {
			"hintText": [
				"Art der systemischen oder abwartenden Therapie (ADT Basisdatensatz Versionen 2014, 2021)"
			],
			"tooltips": {
				"CH": "Chemotherapie",
				"HO": "Hormontherapie",
				"IM": "Immun-/Antikörpertherapie",
				"KM": "Knochenmarktransplantation",
				"ZS": "zielgerichtete Substanzen",
				"CI": "Chemo- + Immun-/Antikörpertherapie",
				"CZ": "Chemotherapie + zielgerichtete Substanzen",
				"CIZ": "Chemo- + Immun-/Antikörpertherapie + zielgerichtete Substanzen",
				"IZ": "Immun-/Antikörpertherapie + zielgerichtete Substanzen",
				"SZ": "Stammzelltransplantation (inklusive Knochenmarktransplantation)",
				"AS": "Active Surveillance",
				"WS": "Wait and see",
				"WW": "Watchful Waiting",
				"SO": "Sonstiges"
			}
		},
		"sample_kind": {
			"hintText": [
				"Verteilung der Probentypen die mit den identifizierten Patienten verbunden sind."
			],
			"accumulatedValues": [
				{
					"name": "ffpe-tissue",
					"values": [
						"tissue-ffpe",
						"tumor-tissue-ffpe",
						"normal-tissue-ffpe",
						"other-tissue-ffpe"
					]
				},
				{
					"name": "frozen-tissue",
					"values": [
						"tissue-frozen",
						"tumor-tissue-frozen",
						"normal-tissue-frozen",
						"other-tissue-frozen"
					]
				}
			],
			"tooltips": {
				"ffpe-tissue": "Gewebe FFPE",
				"frozen-tissue": "Gewebe schockgefroren",
				"tissue-other": "Gewebe, Andere Konservierungsart",
				"whole-blood": "Vollblut",
				"blood-serum": "Serum",
				"blood-plasma": "Plasma",
				"buffy-coat": "Buffy Coat",
				"peripheral-blood-cells": "Periphere mononukleäre Blutzellen (PBMC)",
				"dried-whole-blood": "Blutkarten",
				"swab": "Abstrich",
				"ascites": "Aszites",
				"stool-faeces": "Stuhl",
				"urine": "Urin",
				"csf-liquor": "Liquor",
				"bone-marrow": "Knochenmark",
				"saliva": "Speichel",
				"liquid-other": "Flüssigprobe, Andere",
				"dna": "DNA",
				"rna": "RNA",
				"derivative-other": "Derivat, Andere"
			},
			"legendMapping": {
				"ffpe-tissue": "Gewebe FFPE",
				"frozen-tissue": "Gewebe schockgefroren",
				"tissue-other": "Gewebe, Andere Konservierungsart",
				"whole-blood": "Vollblut",
				"blood-serum": "Serum",
				"blood-plasma": "Plasma",
				"buffy-coat": "Buffy Coat",
				"peripheral-blood-cells": "Periphere mononukleäre Blutzellen (PBMC)",
				"dried-whole-blood": "Blutkarten",
				"swab": "Abstrich",
				"ascites": "Aszites",
				"stool-faeces": "Stuhl",
				"urine": "Urin",
				"csf-liquor": "Liquor",
				"bone-marrow": "Knochenmark",
				"saliva": "Speichel",
				"liquid-other": "Flüssigprobe, Andere",
				"dna": "DNA",
				"rna": "RNA",
				"derivative-other": "Derivat, Andere"
			}
		}
	},
	"tableOptions": {
		"headerData": [
			{
				"title": "Standorte",
				"dataKey": "site"
			},
			{
				"title": "Patienten",
				"dataKey": "patients"
			},
			{
				"title": "Bioproben*",
				"aggregatedDataKeys": [
					{
						"groupCode": "specimen"
					},
					{
						"stratifierCode": "Histologies",
						"stratumCode": "1"
					}
				]
			}
		]
	},
	"resultSummaryOptions": {
		"title": "Ergebnisse",
		"infoButtonText": "Um eine Re-Identifizierung zu erschweren, werden Standortergebnisse modifiziert und auf Zehnerstellen gerundet. Meldet ein Standort keinen Treffer, wird für diesen null angezeigt.",
		"dataTypes": [
			{
				"title": "Standorte",
				"dataKey": "collections"
			},
			{
				"title": "Patienten",
				"dataKey": "patients"
			}
		]
	}
}
