{
	"spotUrl": "http://localhost:8055",
	"language": "de",
	"siteMappings": {
        "proxy2": "Proxy2 Test Server",
		"berlin": "Berlin (OBDS)",
		"berlin-test": "Berlin",
		"bonn": "Bonn",
		"dresden": "Dresden",
		"essen": "Essen",
		"frankfurt": "Frankfurt",
		"freiburg": "Freiburg",
		"hannover": "Hannover",
		"mainz": "Mainz",
		"muenchen-lmu": "München(LMU)",
		"muenchen-tum": "München(TUM)",
		"ulm": "Ulm",
		"marburg": "Marburg",
		"luebeck": "UKSH (Lübeck)",
		"wuerzburg": "Würzburg",
		"mannheim": "Mannheim",
		"dktk-test": "DKTK-Test",
		"dktk-datashield-test": "DKTK Datashield Test",
		"hamburg": "Hamburg"
	},
	"chartOptions": {
		"gender": {
			"legendMapping": {
				"male": "Männlich",
				"female": "Weiblich",
				"unknown": "Unbekannt",
				"other": "Divers"
			}
		},
		"diagnosis": {
			"hintText": [
				"Bei Patienten mit mehreren onkologischen Diagnosen werden auch Einträge angezeigt, die ggfs. nicht den ausgewählten Suchkriterien entsprechen."
			]
		},
		"age_at_diagnosis": {
			"hintText": [
				"Bei Patienten mit mehreren Erstdiagnosen werden auch Einträge angezeigt, die ggfs. außerhalb der Suchkriterien liegen. "
			]
		},
		"75186-7": {
			"hintText": [
				"\"verstorben\": ein Todesdatum ist dokumentiert oder das aktuelle Lebensalter ist größer 123 Jahre.",
				"\"lebend\": wird angenommen, wenn kein Todesdatum dokumentiert ist oder das aktuelle Lebensalter nicht 123 Jahre überschritten hat.",
				"\"unbekannt\": kein Geburtsdatum oder Todesdatum bekannt."
			]
		},
		"therapy_of_tumor": {
			"hintText": [
				"Bei Patienten mit mehreren onkologischen Diagnosen werden auch Einträge angezeigt, die ggfs. nicht den ausgewählten Suchkriterien entsprechen."
			],
			"aggregations": ["medicationStatements"],
			"tooltips": {
				"OP": "Operationen",
				"ST": "Strahlentherapien",
				"medicationStatements": "Systemische Therapien"
			}
		},
		"medicationStatements": {
			"hintText": [
				"Art der systemischen oder abwartenden Therapie (ADT Basisdatensatz Versionen 2014, 2021)"
			],
			"tooltips": {
				"CH": "Chemotherapie",
				"HO": "Hormontherapie",
				"IM": "Immun-/Antikörpertherapie",
				"KM": "Knochenmarktransplantation",
				"ZS": "zielgerichtete Substanzen",
				"CI": "Chemo- + Immun-/Antikörpertherapie",
				"CZ": "Chemotherapie + zielgerichtete Substanzen",
				"CIZ": "Chemo- + Immun-/Antikörpertherapie + zielgerichtete Substanzen",
				"IZ": "Immun-/Antikörpertherapie + zielgerichtete Substanzen",
				"SZ": "Stammzelltransplantation (inklusive Knochenmarktransplantation)",
				"AS": "Active Surveillance",
				"WS": "Wait and see",
				"WW": "Watchful Waiting",
				"SO": "Sonstiges"
			}
		},
		"sample_kind": {
			"hintText": [
				"Verteilung der Probentypen die mit den identifizierten Patienten verbunden sind."
			],
			"accumulatedValues": [
				{
					"name": "ffpe-tissue",
					"values": [
						"tissue-ffpe",
						"tumor-tissue-ffpe",
						"normal-tissue-ffpe",
						"other-tissue-ffpe"
					]
				},
				{
					"name": "frozen-tissue",
					"values": [
						"tissue-frozen",
						"tumor-tissue-frozen",
						"normal-tissue-frozen",
						"other-tissue-frozen"
					]
				}
			],
			"tooltips": {
				"ffpe-tissue": "Gewebe FFPE",
				"frozen-tissue": "Gewebe schockgefroren",
				"tissue-other": "Gewebe, Andere Konservierungsart",
				"whole-blood": "Vollblut",
				"blood-serum": "Serum",
				"blood-plasma": "Plasma",
				"buffy-coat": "Buffy Coat",
				"peripheral-blood-cells": "Periphere mononukleäre Blutzellen (PBMC)",
				"dried-whole-blood": "Blutkarten",
				"swab": "Abstrich",
				"ascites": "Aszites",
				"stool-faeces": "Stuhl",
				"urine": "Urin",
				"csf-liquor": "Liquor",
				"bone-marrow": "Knochenmark",
				"saliva": "Speichel",
				"liquid-other": "Flüssigprobe, Andere",
				"dna": "DNA",
				"rna": "RNA",
				"derivative-other": "Derivat, Andere"
			},
			"legendMapping": {
				"ffpe-tissue": "Gewebe FFPE",
				"frozen-tissue": "Gewebe schockgefroren",
				"tissue-other": "Gewebe, Andere Konservierungsart",
				"whole-blood": "Vollblut",
				"blood-serum": "Serum",
				"blood-plasma": "Plasma",
				"buffy-coat": "Buffy Coat",
				"peripheral-blood-cells": "Periphere mononukleäre Blutzellen (PBMC)",
				"dried-whole-blood": "Blutkarten",
				"swab": "Abstrich",
				"ascites": "Aszites",
				"stool-faeces": "Stuhl",
				"urine": "Urin",
				"csf-liquor": "Liquor",
				"bone-marrow": "Knochenmark",
				"saliva": "Speichel",
				"liquid-other": "Flüssigprobe, Andere",
				"dna": "DNA",
				"rna": "RNA",
				"derivative-other": "Derivat, Andere"
			}
		}
	},
	"tableOptions": {
		"headerData": [
			{
				"title": "Standorte",
				"dataKey": "site"
			},
			{
				"title": "Patienten",
				"dataKey": "patients"
			},
			{
				"title": "Bioproben*",
				"dataKey": "specimen"
			}
		]
	},
	"resultSummaryOptions": {
		"title": "Ergebnisse",
		"infoButtonText": "Umfang und Vollständigkeit der abfragbaren Daten hängt vom Datenimport in die lokalen Brückenköpfe durch die Standorte ab. Bekannte Limitation sind unter \"Known Issues\" (siehe „Weiterführende Informationen“) aufgeführt. Um eine Re-Identifizierung zu erschweren, werden Standortergebnisse modifiziert und auf Zehnerstellen gerundet. Meldet ein Standort keinen Treffer, wird für diesen null angezeigt.",
		"dataTypes": [
			{
				"title": "Standorte",
				"dataKey": "collections"
			},
			{
				"title": "Patienten",
				"dataKey": "patients"
			},
			{
				"title": "Bioproben",
				"dataKey": "specimen"
			}
		]
	},
	"projectmanagerOptions": {
		"newProjectUrl": "https://requests.dktk.dkfz.de/project-manager-api/create-query-and-design-project",
		"editProjectUrl": "https://requests.dktk.dkfz.de/project-manager-api/edit-project",
		"siteMappings": [
			{
				"site": "DKTK-Test",
				"collection": "lens-dktk-test"
			},
			{
				"site": "dktk-datashield-test",
				"collection": "lens-dktk-datashield-test"
			},
			{
				"site": "Berlin",
				"collection": "lens-berlin"
			},
			{
				"site": "Berlin (OBDS)",
				"collection": "lens-berlin"
			},
			{
				"site": "Dresden",
				"collection": "lens-dresden"
			},
			{
				"site": "Essen",
				"collection": "lens-essen"
			},
			{
				"site": "Frankfurt",
				"collection": "lens-frankfurt"
			},
			{
				"site": "Freiburg",
				"collection": "lens-freiburg"
			},
			{
				"site": "Hannover",
				"collection": "lens-hannover"
			},
			{
				"site": "Mainz",
				"collection": "lens-mainz"
			},
			{
				"site": "München(LMU)",
				"collection": "lens-muenchen-lmu"
			},
			{
				"site": "München(TUM)",
				"collection": "lens-muenchen-tum"
			},
			{
				"site": "Ulm",
				"collection": "lens-ulm"
			},
			{
				"site": "Würzburg",
				"collection": "lens-wuerzburg"
			},
			{
				"site": "Mannheim",
				"collection": "lens-mannheim"
			},
			{
				"site": "Hamburg",
				"collection": "lens-hamburg"
			}
		]
	}
}
